{
  "schema_version": "1.0",
  "binding_contract_version": "1.0.0",
  "target_url": "https://example.test/",
  "execution_run_id": "fixture-full-48-active-v1",
  "mode": "FIXTURE",
  "generated_at": "2026-09-07T21:36:00Z",
  "evidence_catalog": [
    {
      "id": "E-1001",
      "source_family": "PUBLIC_DETERMINISTIC_TECHNICAL",
      "target_url": "https://example.test/",
      "status": "MEASURED",
      "evidence_grade": "E4",
      "digest": "7d162fb2b94d042d98edeee89dc4f145fbc839b14a8e2dfd9c8ab0939b23d9ec",
      "reference": "fixture://full-48/FIND-01",
      "claim_boundary": "Synthetic fixture proves the execution-to-score contract only; it is not live website evidence.",
      "raw_provider_payload_present": false
    },
    {
      "id": "E-1002",
      "source_family": "PUBLIC_DETERMINISTIC_TECHNICAL",
      "target_url": "https://example.test/",
      "status": "MEASURED",
      "evidence_grade": "E4",
      "digest": "30ecb7fc2d3c7dd703cf39af44702f503189a0364606c7251394b5f950aa0149",
      "reference": "fixture://full-48/FIND-02",
      "claim_boundary": "Synthetic fixture proves the execution-to-score contract only; it is not live website evidence.",
      "raw_provider_payload_present": false
    },
    {
      "id": "E-1003",
      "source_family": "STRUCTURED_CONTENT_DOM_METADATA",
      "target_url": "https://example.test/",
      "status": "OBSERVED",
      "evidence_grade": "E4",
      "digest": "7cfcfbc8feee3b24e0e72c7e786ccb07e13491ca14692e1e9decef15ac5f8fdb",
      "reference": "fixture://full-48/FIND-03",
      "claim_boundary": "Synthetic fixture proves the execution-to-score contract only; it is not live website evidence.",
      "raw_provider_payload_present": false
    },
    {
      "id": "E-1004",
      "source_family": "SEARCH_INDEXING_SERP",
      "target_url": "https://example.test/",
      "status": "OBSERVED",
      "evidence_grade": "E5",
      "digest": "cafbe4925e68b6157664ff9fc7328e581d872e5df7e8bc575f7600679f0d59a7",
      "reference": "fixture://full-48/FIND-04",
      "claim_boundary": "Synthetic fixture proves the execution-to-score contract only; it is not live website evidence.",
      "raw_provider_payload_present": false
    },
    {
      "id": "E-1005",
      "source_family": "SEARCH_INDEXING_SERP",
      "target_url": "https://example.test/",
      "status": "OBSERVED",
      "evidence_grade": "E5",
      "digest": "73b83319067d46d93a91991f5c4a22e8c96340e00dcdbf5853486c312f9d3dc1",
      "reference": "fixture://full-48/FIND-05",
      "claim_boundary": "Synthetic fixture proves the execution-to-score contract only; it is not live website evidence.",
      "raw_provider_payload_present": false
    },
    {
      "id": "E-1006",
      "source_family": "STRUCTURED_CONTENT_DOM_METADATA",
      "target_url": "https://example.test/",
      "status": "OBSERVED",
      "evidence_grade": "E4",
      "digest": "f0bb05a013e3cc7d1bd4a44d57abf28fb86d768e6a5ab861f9616bc43c32bc8f",
      "reference": "fixture://full-48/FIND-06",
      "claim_boundary": "Synthetic fixture proves the execution-to-score contract only; it is not live website evidence.",
      "raw_provider_payload_present": false
    },
    {
      "id": "E-1007",
      "source_family": "STRUCTURED_CONTENT_DOM_METADATA",
      "target_url": "https://example.test/",
      "status": "OBSERVED",
      "evidence_grade": "E4",
      "digest": "7d9208c0b1d79e747c55442a14df2aefd96983a6b4e2e01b60c9f1bb8593d2da",
      "reference": "fixture://full-48/FIND-07",
      "claim_boundary": "Synthetic fixture proves the execution-to-score contract only; it is not live website evidence.",
      "raw_provider_payload_present": false
    },
    {
      "id": "E-1008",
      "source_family": "PUBLIC_DETERMINISTIC_TECHNICAL",
      "target_url": "https://example.test/",
      "status": "MEASURED",
      "evidence_grade": "E4",
      "digest": "39b5386927dbf4d22b91269bdb244365a92351e9563959335975929dfd89485d",
      "reference": "fixture://full-48/FIND-08",
      "claim_boundary": "Synthetic fixture proves the execution-to-score contract only; it is not live website evidence.",
      "raw_provider_payload_present": false
    },
    {
      "id": "E-1009",
      "source_family": "STRUCTURED_CONTENT_DOM_METADATA",
      "target_url": "https://example.test/",
      "status": "OBSERVED",
      "evidence_grade": "E4",
      "digest": "2a51dbcad34bba7b3a52dccb0689c3fb04ecc3f33e446668cf7f63c5b406448a",
      "reference": "fixture://full-48/FIND-09",
      "claim_boundary": "Synthetic fixture proves the execution-to-score contract only; it is not live website evidence.",
      "raw_provider_payload_present": false
    },
    {
      "id": "E-1010",
      "source_family": "STRUCTURED_CONTENT_DOM_METADATA",
      "target_url": "https://example.test/",
      "status": "OBSERVED",
      "evidence_grade": "E4",
      "digest": "1ed1098309785146e8301e549f7c54eb6f5a3e2e5261ea0e16d04bb48489323f",
      "reference": "fixture://full-48/FIND-10",
      "claim_boundary": "Synthetic fixture proves the execution-to-score contract only; it is not live website evidence.",
      "raw_provider_payload_present": false
    },
    {
      "id": "E-1011",
      "source_family": "PERFORMANCE_CWV_LAB",
      "target_url": "https://example.test/",
      "status": "MEASURED",
      "evidence_grade": "E2",
      "digest": "1ff3ed141fb2109f9ad267b0e9fc26c2335972f575c5b07720a238d36e0f10c8",
      "reference": "fixture://full-48/PERF-01",
      "claim_boundary": "Synthetic fixture proves the execution-to-score contract only; it is not live website evidence.",
      "raw_provider_payload_present": false
    },
    {
      "id": "E-1012",
      "source_family": "PERFORMANCE_CWV_LAB",
      "target_url": "https://example.test/",
      "status": "MEASURED",
      "evidence_grade": "E2",
      "digest": "0ad62f2af9235ab00cf92dec95629f2e23aaa7ed40c639e1abd03693d6b89cab",
      "reference": "fixture://full-48/PERF-02",
      "claim_boundary": "Synthetic fixture proves the execution-to-score contract only; it is not live website evidence.",
      "raw_provider_payload_present": false
    },
    {
      "id": "E-1013",
      "source_family": "PERFORMANCE_CWV_LAB",
      "target_url": "https://example.test/",
      "status": "MEASURED",
      "evidence_grade": "E2",
      "digest": "e3983e6bcf7dd82203fcf08b0e47dd3f623dc48319c488d2636532fe41f33a46",
      "reference": "fixture://full-48/PERF-03",
      "claim_boundary": "Synthetic fixture proves the execution-to-score contract only; it is not live website evidence.",
      "raw_provider_payload_present": false
    },
    {
      "id": "E-1014",
      "source_family": "PUBLIC_DETERMINISTIC_TECHNICAL",
      "target_url": "https://example.test/",
      "status": "MEASURED",
      "evidence_grade": "E4",
      "digest": "7b052791c514cc7413292b29fc622b3473284ad991711788ac1983eda8a1f284",
      "reference": "fixture://full-48/PERF-04",
      "claim_boundary": "Synthetic fixture proves the execution-to-score contract only; it is not live website evidence.",
      "raw_provider_payload_present": false
    },
    {
      "id": "E-1015",
      "source_family": "PUBLIC_DETERMINISTIC_TECHNICAL",
      "target_url": "https://example.test/",
      "status": "MEASURED",
      "evidence_grade": "E4",
      "digest": "d1a5d5bb0fab110d73d53be47544b14fd8e8884dc5dc36d3400baec5249f971f",
      "reference": "fixture://full-48/PERF-05",
      "claim_boundary": "Synthetic fixture proves the execution-to-score contract only; it is not live website evidence.",
      "raw_provider_payload_present": false
    },
    {
      "id": "E-1016",
      "source_family": "PUBLIC_DETERMINISTIC_TECHNICAL",
      "target_url": "https://example.test/",
      "status": "MEASURED",
      "evidence_grade": "E4",
      "digest": "726384fc47c989a18412d62aaf6cf844502f13edc14d22e261a84dc9180b7052",
      "reference": "fixture://full-48/PERF-06",
      "claim_boundary": "Synthetic fixture proves the execution-to-score contract only; it is not live website evidence.",
      "raw_provider_payload_present": false
    },
    {
      "id": "E-1017",
      "source_family": "PUBLIC_DETERMINISTIC_TECHNICAL",
      "target_url": "https://example.test/",
      "status": "MEASURED",
      "evidence_grade": "E4",
      "digest": "43207cdfec28de32cdf599eedf7ed7218cf5dfbd67b467a63288261f8fb2cc5d",
      "reference": "fixture://full-48/PERF-07",
      "claim_boundary": "Synthetic fixture proves the execution-to-score contract only; it is not live website evidence.",
      "raw_provider_payload_present": false
    },
    {
      "id": "E-1018",
      "source_family": "BROWSER_RENDERING",
      "target_url": "https://example.test/",
      "status": "OBSERVED",
      "evidence_grade": "E4",
      "digest": "0c47fa89d2e7335cae4e9ce0966a23fb40285310936f60520365bc642bdd22d1",
      "reference": "fixture://full-48/PERF-08",
      "claim_boundary": "Synthetic fixture proves the execution-to-score contract only; it is not live website evidence.",
      "raw_provider_payload_present": false
    },
    {
      "id": "E-1019",
      "source_family": "STRUCTURED_CONTENT_DOM_METADATA",
      "target_url": "https://example.test/",
      "status": "OBSERVED",
      "evidence_grade": "E5",
      "digest": "f234c53d8c01ee9c89f6a2b833364f756d71d550ae984a34339e80be93a82a11",
      "reference": "fixture://full-48/PERF-09",
      "claim_boundary": "Synthetic fixture proves the execution-to-score contract only; it is not live website evidence.",
      "raw_provider_payload_present": false
    },
    {
      "id": "E-1020",
      "source_family": "BROWSER_RENDERING",
      "target_url": "https://example.test/",
      "status": "OBSERVED",
      "evidence_grade": "E6",
      "digest": "35e0e0b08c654c0ccf23041f44999398dff23f97adc27cc0e03b2b77f459a877",
      "reference": "fixture://full-48/UX-01",